{
  "$schema": "./release-set.schema.json",
  "schema_version": 1,
  "name": "hyprwm-fedora-stable",
  "fedora_release": 44,
  "revision": "2026.07.15-1",
  "architectures": [
    "x86_64",
    "aarch64"
  ],
  "packages": {
    "glaze": {
      "path": "packages/glaze",
      "version": "7.2.0",
      "release": 1,
      "tier": 0,
      "update_policy": "pinned",
      "update_reason": "Match the Glaze 7.2.0 fallback selected by Hyprland 0.55.4; review upgrades with the complete release set.",
      "build_after": [],
      "sources": [
        {
          "filename": "glaze-7.2.0.tar.gz",
          "url": "https://github.com/stephenberry/glaze/archive/refs/tags/v7.2.0.tar.gz",
          "sha256": "17dba19ae63ae48f94994f00d49d5cb3c8f1306db1046c534c4828662490b7d4",
          "provenance": "official-upstream",
          "reference": "stephenberry/glaze tag v7.2.0"
        }
      ]
    },
    "lua5.5": {
      "path": "packages/lua5.5",
      "version": "5.5.0",
      "release": 1,
      "tier": 0,
      "update_policy": "manual",
      "update_reason": "Lua releases and official test archives are published by lua.org rather than a supported GitHub tag source.",
      "build_after": [],
      "sources": [
        {
          "filename": "lua-5.5.0.tar.gz",
          "url": "https://www.lua.org/ftp/lua-5.5.0.tar.gz",
          "sha256": "57ccc32bbbd005cab75bcc52444052535af691789dba2b9016d5c50640d68b3d",
          "provenance": "official-upstream",
          "reference": "Lua.org release 5.5.0"
        },
        {
          "filename": "lua-5.5.0-tests.tar.gz",
          "url": "https://www.lua.org/tests/lua-5.5.0-tests.tar.gz",
          "sha256": "5e47bbfad7db2965d69580e918ee64edeb8d8d32de404b8dae9ce5c6d76a1472",
          "provenance": "official-upstream",
          "reference": "Lua.org 5.5.0 test suite"
        },
        {
          "filename": "lua-5.5.0-bug1.patch",
          "url": "https://src.fedoraproject.org/rpms/lua/raw/e658e44a5ef9c611b9f4d006599a792874ab6555/f/lua-5.5.0-bug1.patch",
          "sha256": "7aea4d67cebf4f40a9b82356b7d0f7e11d3389f5e8a910fa17a88333a7b5cda7",
          "provenance": "official-fedora",
          "reference": "Fedora lua dist-git commit e658e44a5ef9c611b9f4d006599a792874ab6555"
        },
        {
          "filename": "lua-5.5.0-bug2.patch",
          "url": "https://src.fedoraproject.org/rpms/lua/raw/e658e44a5ef9c611b9f4d006599a792874ab6555/f/lua-5.5.0-bug2.patch",
          "sha256": "3420c371dab80f570a87494f2f6e4ea9fcba1cacb632b2d0f61c438ae6499b0f",
          "provenance": "official-fedora",
          "reference": "Fedora lua dist-git commit e658e44a5ef9c611b9f4d006599a792874ab6555"
        }
      ]
    },
    "hyprwayland-scanner": {
      "path": "packages/hyprwayland-scanner",
      "version": "0.4.6",
      "release": 1,
      "tier": 1,
      "build_after": [],
      "sources": [
        {
          "filename": "hyprwayland-scanner-0.4.6.tar.gz",
          "url": "https://github.com/hyprwm/hyprwayland-scanner/archive/refs/tags/v0.4.6.tar.gz",
          "sha256": "05f55fd1a20d8ca81b5030980fdb7c87147749230145bdb3745af2741d617f5c",
          "provenance": "official-upstream",
          "reference": "hyprwm/hyprwayland-scanner tag v0.4.6"
        }
      ]
    },
    "hyprutils": {
      "path": "packages/hyprutils",
      "version": "0.13.1",
      "release": 1,
      "tier": 1,
      "build_after": [],
      "sources": [
        {
          "filename": "hyprutils-0.13.1.tar.gz",
          "url": "https://github.com/hyprwm/hyprutils/archive/refs/tags/v0.13.1.tar.gz",
          "sha256": "480ee026105deea64a24eb96d80cabe54b357594ce36cb05c021ea226c69aede",
          "provenance": "official-upstream",
          "reference": "hyprwm/hyprutils tag v0.13.1"
        }
      ]
    },
    "hyprland-protocols": {
      "path": "packages/hyprland-protocols",
      "version": "0.7.0",
      "release": 1,
      "tier": 1,
      "build_after": [],
      "sources": [
        {
          "filename": "hyprland-protocols-0.7.0.tar.gz",
          "url": "https://github.com/hyprwm/hyprland-protocols/archive/refs/tags/v0.7.0.tar.gz",
          "sha256": "ee419006d7cd20927b9b7c8b5fc430571c151b0385d600508de1a7957294498c",
          "provenance": "official-upstream",
          "reference": "hyprwm/hyprland-protocols tag v0.7.0"
        }
      ]
    },
    "hyprlang": {
      "path": "packages/hyprlang",
      "version": "0.6.8",
      "release": 1,
      "tier": 2,
      "build_after": [
        "hyprutils"
      ],
      "sources": [
        {
          "filename": "hyprlang-0.6.8.tar.gz",
          "url": "https://github.com/hyprwm/hyprlang/archive/refs/tags/v0.6.8.tar.gz",
          "sha256": "d10a0778b646e04d83e8b90cc0f764fb96958c01a15c3c0678d95a40fc647ed5",
          "provenance": "official-upstream",
          "reference": "hyprwm/hyprlang tag v0.6.8"
        }
      ]
    },
    "hyprgraphics": {
      "path": "packages/hyprgraphics",
      "version": "0.5.1",
      "release": 1,
      "tier": 2,
      "build_after": [
        "hyprutils"
      ],
      "sources": [
        {
          "filename": "hyprgraphics-0.5.1.tar.gz",
          "url": "https://github.com/hyprwm/hyprgraphics/archive/refs/tags/v0.5.1.tar.gz",
          "sha256": "861ecaad872835922dd5745a612d7a4cc7bfc4babb1d06bc92bc63c2ac013b74",
          "provenance": "official-upstream",
          "reference": "hyprwm/hyprgraphics tag v0.5.1"
        },
        {
          "filename": "3b41722bc01e7b56b0c2bda5f9f819793bdf1596.patch",
          "url": "https://github.com/hyprwm/hyprgraphics/commit/3b41722bc01e7b56b0c2bda5f9f819793bdf1596.patch",
          "sha256": "72a22afb4382ce227b3a1c0e7460992492f70dbab0cc9c4ca93ca71a1dfaeefc",
          "provenance": "official-upstream",
          "reference": "hyprwm/hyprgraphics commit 3b41722bc01e7b56b0c2bda5f9f819793bdf1596"
        },
        {
          "filename": "090db94649f25b476918f8afcfd443c02cc0a4b9.patch",
          "url": "https://github.com/hyprwm/hyprgraphics/commit/090db94649f25b476918f8afcfd443c02cc0a4b9.patch",
          "sha256": "2ae3604361cc30711ef2e0dbaffb7284f94dc1a41894c39e452d15bf4bedb003",
          "provenance": "official-upstream",
          "reference": "hyprwm/hyprgraphics commit 090db94649f25b476918f8afcfd443c02cc0a4b9"
        }
      ]
    },
    "hyprwire": {
      "path": "packages/hyprwire",
      "version": "0.3.1",
      "release": 1,
      "tier": 2,
      "build_after": [
        "hyprutils"
      ],
      "sources": [
        {
          "filename": "hyprwire-0.3.1.tar.gz",
          "url": "https://github.com/hyprwm/hyprwire/archive/refs/tags/v0.3.1.tar.gz",
          "sha256": "92a673d40ae6a7d66fbcd0a34ec071e026e17eaeeb0040c3375e4b2a80dba737",
          "provenance": "official-upstream",
          "reference": "hyprwm/hyprwire tag v0.3.1"
        }
      ]
    },
    "hyprcursor": {
      "path": "packages/hyprcursor",
      "version": "0.1.13",
      "release": 1,
      "tier": 3,
      "build_after": [
        "hyprlang"
      ],
      "sources": [
        {
          "filename": "hyprcursor-0.1.13.tar.gz",
          "url": "https://github.com/hyprwm/hyprcursor/archive/refs/tags/v0.1.13.tar.gz",
          "sha256": "82af8b2ce27242ffdd6baebaa71b3f6c8665dc25c52bfcfccc16912622896af8",
          "provenance": "official-upstream",
          "reference": "hyprwm/hyprcursor tag v0.1.13"
        },
        {
          "filename": "HyprBibataModernClassicSVG.tar.gz",
          "url": "https://src.fedoraproject.org/repo/pkgs/rpms/hyprcursor/HyprBibataModernClassicSVG.tar.gz/sha512/a1fff9d9a3a3b0de6824036559b495394a71bf56c25bd7cbd2bc0a3d51f74c09191c4695480ddc60e725a693d109aa7b174810ae43aa51542d0a8312a0e7e846/HyprBibataModernClassicSVG.tar.gz",
          "sha256": "28362850b8c90b4361771f4fcf9133abed45d2d5b09154087396eecb4ee13bdf",
          "provenance": "official-fedora",
          "reference": "Fedora hyprcursor lookaside test source"
        }
      ]
    },
    "aquamarine": {
      "path": "packages/aquamarine",
      "version": "0.12.1",
      "release": 1,
      "tier": 3,
      "build_after": [
        "hyprutils",
        "hyprwayland-scanner"
      ],
      "sources": [
        {
          "filename": "aquamarine-0.12.1.tar.gz",
          "url": "https://github.com/hyprwm/aquamarine/archive/refs/tags/v0.12.1.tar.gz",
          "sha256": "80120257c983e18dec78c4df03246931b1bca1e44e50fb41ca21bad772479bd9",
          "provenance": "official-upstream",
          "reference": "hyprwm/aquamarine tag v0.12.1"
        }
      ]
    },
    "hyprland": {
      "path": "packages/hyprland",
      "version": "0.55.4",
      "release": 3,
      "tier": 4,
      "update_policy": "manual",
      "update_reason": "Hyprland updates require a repository-wide compatibility lock and an exact hyprland-plugins commit from upstream hyprpm.toml.",
      "build_after": [
        "aquamarine",
        "glaze",
        "hyprcursor",
        "hyprgraphics",
        "hyprland-protocols",
        "hyprlang",
        "hyprutils",
        "hyprwayland-scanner",
        "hyprwire",
        "lua5.5"
      ],
      "sources": [
        {
          "filename": "hyprland-0.55.4.tar.gz",
          "url": "https://github.com/hyprwm/Hyprland/releases/download/v0.55.4/source-v0.55.4.tar.gz",
          "sha256": "10cdda47e6a42e603a646ffda89c9fca0628c3a8211e2fbbee02f6282effe30b",
          "provenance": "official-upstream",
          "reference": "hyprwm/Hyprland release v0.55.4 at commit a0136d8c04687bb36eb8a28eb9d1ff92aea99704"
        }
      ]
    },
    "hyprtoolkit": {
      "path": "packages/hyprtoolkit",
      "version": "0.5.4",
      "release": 1,
      "tier": 4,
      "build_after": [
        "aquamarine",
        "hyprgraphics",
        "hyprlang",
        "hyprutils",
        "hyprwayland-scanner"
      ],
      "sources": [
        {
          "filename": "hyprtoolkit-0.5.4.tar.gz",